{
  "schemaVersion": "redact-secret.site-feed/v1",
  "generatedAt": "2026-10-10T00:00:00Z",
  "sources": [
    {
      "role": "release-manifest",
      "path": "docs/releases/0.1.0-beta.15/manifest.json",
      "sha256": "a318c17d0154f945a7391bda182589dfadbde701d01de272c28f93bf03298516"
    },
    {
      "role": "support-matrix",
      "path": "benchmarks/support-matrix.json",
      "sha256": "8f6c9d91120407fa82271183e00355c270628bc484d39a88e8a83306b7645552"
    }
  ],
  "release": {
    "version": "0.1.0-beta.15",
    "tag": "v0.1.0-beta.15",
    "sourceRevision": "2aea4ee95ccf9a5b891ad77f30e2edd8213622fd",
    "verifiedOn": "2026-10-10",
    "packages": [
      {
        "ecosystem": "npm",
        "name": "@redact-secret/core",
        "version": "0.1.0-beta.15"
      },
      {
        "ecosystem": "npm",
        "name": "@redact-secret/node-darwin-arm64",
        "version": "0.1.0-beta.15"
      },
      {
        "ecosystem": "npm",
        "name": "@redact-secret/node-darwin-x64",
        "version": "0.1.0-beta.15"
      },
      {
        "ecosystem": "npm",
        "name": "@redact-secret/node-linux-arm64-gnu",
        "version": "0.1.0-beta.15"
      },
      {
        "ecosystem": "npm",
        "name": "@redact-secret/node-linux-arm64-musl",
        "version": "0.1.0-beta.15"
      },
      {
        "ecosystem": "npm",
        "name": "@redact-secret/node-linux-x64-gnu",
        "version": "0.1.0-beta.15"
      },
      {
        "ecosystem": "npm",
        "name": "@redact-secret/node-linux-x64-musl",
        "version": "0.1.0-beta.15"
      },
      {
        "ecosystem": "npm",
        "name": "@redact-secret/node-win32-arm64-msvc",
        "version": "0.1.0-beta.15"
      },
      {
        "ecosystem": "npm",
        "name": "@redact-secret/node-win32-x64-msvc",
        "version": "0.1.0-beta.15"
      },
      {
        "ecosystem": "npm",
        "name": "@redact-secret/wasm",
        "version": "0.1.0-beta.15"
      },
      {
        "ecosystem": "crates",
        "name": "redact-secret",
        "version": "0.1.0-beta.15"
      },
      {
        "ecosystem": "crates",
        "name": "redact-secret-cli",
        "version": "0.1.0-beta.15"
      },
      {
        "ecosystem": "pypi",
        "name": "redact-secret",
        "version": "0.1.0b15"
      }
    ]
  },
  "supportMatrix": {
    "benchmarksRevision": "573e128863e0543133e5ccbd513216d19513b7da",
    "generatedAt": "2026-10-02T19:28:20Z",
    "measuredProductVersion": "0.1.0-beta.13",
    "measuredProductRevision": "fe6e9234d40e7d5964de27d00d33544f9c621dbf",
    "gatedLatestRelease": false,
    "providerCount": 92,
    "familyCount": 173,
    "distribution": {
      "stable": 144,
      "provisional": 7,
      "pending": 5,
      "unsupported": 17
    },
    "families": [
      {
        "provider": "ai21",
        "family": "ai21:api-key",
        "name": "API key (unprefixed)",
        "status": "stable",
        "evidenceTier": "T2",
        "qualificationProfile": "empirical"
      },
      {
        "provider": "anthropic",
        "family": "anthropic:admin-api-key",
        "name": "Admin API key (sk-ant-admin01-)",
        "status": "stable",
        "evidenceTier": "T1",
        "qualificationProfile": "documented"
      },
      {
        "provider": "anthropic",
        "family": "anthropic:compliance-access-key",
        "name": "Enterprise organization key (sk-ant-api01-)",
        "status": "stable",
        "evidenceTier": "T1",
        "qualificationProfile": "documented"
      },
      {
        "provider": "anthropic",
        "family": "anthropic:secret-api-key",
        "name": "Secret API key",
        "status": "stable",
        "evidenceTier": "T1",
        "qualificationProfile": "documented"
      },
      {
        "provider": "apify",
        "family": "apify:api-token",
        "name": "API token (apify_api_)",
        "status": "stable",
        "evidenceTier": "T1",
        "qualificationProfile": "documented"
      },
      {
        "provider": "atlassian",
        "family": "atlassian:access-token",
        "name": "Access token",
        "status": "unsupported",
        "evidenceTier": null,
        "qualificationProfile": null
      },
      {
        "provider": "atlassian",
        "family": "atlassian:api-token",
        "name": "API token",
        "status": "stable",
        "evidenceTier": "T2",
        "qualificationProfile": "empirical"
      },
      {
        "provider": "aws-bedrock",
        "family": "aws-bedrock:long-term-api-key",
        "name": "Long-term API key (ABSK)",
        "status": "stable",
        "evidenceTier": "T1",
        "qualificationProfile": "documented"
      },
      {
        "provider": "aws-bedrock",
        "family": "aws-bedrock:short-term-api-key",
        "name": "Short-term API key (bedrock-api-key-)",
        "status": "stable",
        "evidenceTier": "T1",
        "qualificationProfile": "documented"
      },
      {
        "provider": "aws",
        "family": "aws:context-specific-credential",
        "name": "Context-specific credential",
        "status": "unsupported",
        "evidenceTier": null,
        "qualificationProfile": null
      },
      {
        "provider": "aws",
        "family": "aws:iam-user-access-key",
        "name": "IAM user access key",
        "status": "stable",
        "evidenceTier": "T1",
        "qualificationProfile": "documented"
      },
      {
        "provider": "aws",
        "family": "aws:iam-user-secret-access-key",
        "name": "IAM user secret access key",
        "status": "stable",
        "evidenceTier": "T2",
        "qualificationProfile": "empirical"
      },
      {
        "provider": "aws",
        "family": "aws:sts-service-bearer-token",
        "name": "STS service bearer token",
        "status": "unsupported",
        "evidenceTier": null,
        "qualificationProfile": null
      },
      {
        "provider": "aws",
        "family": "aws:sts-temporary-access-key",
        "name": "STS temporary access key",
        "status": "unsupported",
        "evidenceTier": null,
        "qualificationProfile": null
      },
      {
        "provider": "axiom",
        "family": "axiom:api-token",
        "name": "API token (xaat-)",
        "status": "stable",
        "evidenceTier": "T1",
        "qualificationProfile": "documented"
      },
      {
        "provider": "axiom",
        "family": "axiom:personal-token",
        "name": "Personal access token (xapt-)",
        "status": "stable",
        "evidenceTier": "T1",
        "qualificationProfile": "documented"
      },
      {
        "provider": "azure-devops",
        "family": "azure-devops:personal-access-token",
        "name": "Personal access token",
        "status": "stable",
        "evidenceTier": "T1",
        "qualificationProfile": "documented"
      },
      {
        "provider": "bitwarden",
        "family": "bitwarden:secrets-manager-access-token",
        "name": "Secrets Manager access token (0. + UUID layout)",
        "status": "stable",
        "evidenceTier": "T1",
        "qualificationProfile": "documented"
      },
      {
        "provider": "browserbase",
        "family": "browserbase:api-key",
        "name": "API key (bb_live_)",
        "status": "stable",
        "evidenceTier": "T1",
        "qualificationProfile": "documented"
      },
      {
        "provider": "cerebras",
        "family": "cerebras:inference-api-key",
        "name": "Inference API key (csk-)",
        "status": "stable",
        "evidenceTier": "T1",
        "qualificationProfile": "documented"
      },
      {
        "provider": "clickhouse-cloud",
        "family": "clickhouse-cloud:api-key",
        "name": "API key secret (4b1d)",
        "status": "stable",
        "evidenceTier": "T1",
        "qualificationProfile": "documented"
      },
      {
        "provider": "clojars",
        "family": "clojars:deploy-token",
        "name": "Deploy token (CLOJARS_)",
        "status": "stable",
        "evidenceTier": "T1",
        "qualificationProfile": "documented"
      },
      {
        "provider": "cloudflare",
        "family": "cloudflare:api-token",
        "name": "Scannable API token",
        "status": "stable",
        "evidenceTier": "T1",
        "qualificationProfile": "documented"
      },
      {
        "provider": "cohere",
        "family": "cohere:api-key",
        "name": "API key (unprefixed)",
        "status": "stable",
        "evidenceTier": "T2",
        "qualificationProfile": "empirical"
      },
      {
        "provider": "composio",
        "family": "composio:org-api-key",
        "name": "Org API key (oak_)",
        "status": "stable",
        "evidenceTier": "T1",
        "qualificationProfile": "documented"
      },
      {
        "provider": "composio",
        "family": "composio:project-api-key",
        "name": "Project API key (ak_)",
        "status": "stable",
        "evidenceTier": "T1",
        "qualificationProfile": "documented"
      },
      {
        "provider": "composio",
        "family": "composio:user-api-key",
        "name": "User API key (uak_)",
        "status": "stable",
        "evidenceTier": "T1",
        "qualificationProfile": "documented"
      },
      {
        "provider": "confluent",
        "family": "confluent:cloud-api-secret",
        "name": "Cloud API secret (cflt-prefixed)",
        "status": "stable",
        "evidenceTier": "T1",
        "qualificationProfile": "documented"
      },
      {
        "provider": "confluent",
        "family": "confluent:cloud-api-secret-legacy",
        "name": "Cloud API secret (unprefixed, pre-2025-07-30)",
        "status": "stable",
        "evidenceTier": "T2",
        "qualificationProfile": "empirical"
      },
      {
        "provider": "convex",
        "family": "convex:deployment-key",
        "name": "Deployment, project and admin key (hex body)",
        "status": "stable",